<?xml version="1.0" encoding="ISO-8859-1" ?>
<uddi xmlns="urn:juddi-apache-org:v3_client" xsi:schemaLocation="classpath:/xsd/uddi-client.xsd">
        <reloadDelay>5000</reloadDelay>
        <client name="second-client">
                <nodes>
                        <node isHomeJUDDI="true">
                                <name>default</name> 
                                <description>Local jUDDI node</description>
                                <properties>
                                        <property name="serverName" value="localhost" />
                                        <property name="serverPort" value="8880" />
                                        <!-- for UDDI nodes that use HTTP u/p, using the following 
                                        <property name="basicAuthUsername" value="root" />
                                        <property name="basicAuthPassword" value="password" />
                                        <property name="basicAuthPasswordIsEncrypted" value="false" />
                                        <property name="basicAuthPasswordCryptoProvider" value="org.apache.juddi.v3.client.crypto.AES128Cryptor (an example)" />-->
                                </properties>
                                <!-- JAX-WS Transport -->
                                <proxyTransport>org.apache.juddi.v3.client.transport.JAXWSTransport</proxyTransport>
                                <custodyTransferUrl>http://${serverName}:${serverPort}/juddiv3/services/custody-transfer?wsdl</custodyTransferUrl>
                                <inquiryUrl>http://${serverName}:${serverPort}/juddiv3/services/inquiry?wsdl</inquiryUrl>
                                <inquiryRESTUrl>http://${serverName}:${serverPort}/juddiv3/services/inquiryRest</inquiryRESTUrl>
                                <publishUrl>http://${serverName}:${serverPort}/juddiv3/services/publish?wsdl</publishUrl>
                                <securityUrl>http://${serverName}:${serverPort}/juddiv3/services/security?wsdl</securityUrl>
                                <subscriptionUrl>http://${serverName}:${serverPort}/juddiv3/services/subscription?wsdl</subscriptionUrl>
                                <subscriptionListenerUrl>http://${serverName}:${serverPort}/juddiv3/services/subscription-listener?wsdl</subscriptionListenerUrl>
                                <juddiApiUrl>http://${serverName}:${serverPort}/juddiv3/services/juddi-api?wsdl</juddiApiUrl>
                        </node>
                        <node>
                                <name>med</name>
                                <description>jUDDI node in other Department</description>
                                <proxyTransport>org.apache.juddi.v3.client.transport.JAXWSTransport</proxyTransport>
                                <custodyTransferUrl>http://med:8080/juddiv3/services/custody-transfer?wsdl</custodyTransferUrl>
                                <inquiryUrl>http://med:8080/juddiv3/services/inquiry?wsdl</inquiryUrl>
                                <publishUrl>http://med:8080/juddiv3/services/publish?wsdl</publishUrl>
                                <securityUrl>http://med:8080/juddiv3/services/security?wsdl</securityUrl>
                                <subscriptionUrl>http://med:8080/juddiv3/services/subscription?wsdl</subscriptionUrl>
                                <subscriptionListenerUrl>http://med:8080/juddiv3/services/subscription-listener?wsdl</subscriptionListenerUrl>
                                <juddiApiUrl>http://med:8080/juddiv3/services/juddi-api?wsdl</juddiApiUrl>
                        </node>
                </nodes>
		
                <clerks registerOnStartup="false">
                        <!-- root -->
                        <clerk name="default" node="default" publisher="root" password="7d3e79ca453f4ebfd36e22afe029c3a2"
                   isPasswordEncrypted="true" cryptoProvider="org.apache.juddi.v3.client.cryptor.AES128Cryptor"
                        />
                        <!-- password -->
                        <clerk name="medroot" node="med"     publisher="root" password="18604180541d172f9827e08c998db568"
                   isPasswordEncrypted="true" cryptoProvider="org.apache.juddi.v3.client.cryptor.AES128Cryptor"
                        /> 
                        <xregister>
                                <service bindingKey="uddi:juddi.apache.org:servicebindings-subscriptionlistener-ws" 
                         fromClerk="default" toClerk="medroot"/>
                        </xregister>
                </clerks>
                <signature>
                        <!-- signing stuff -->
                        <signingKeyStorePath>keystore.jks</signingKeyStorePath>
                        <signingKeyStoreType>JKS</signingKeyStoreType>
                        <signingKeyStoreFilePassword 
                                isPasswordEncrypted="false" 
                                cryptoProvider="org.apache.juddi.v3.client.crypto.AES128Cryptor">password</signingKeyStoreFilePassword>
                        <signingKeyPassword
                                isPasswordEncrypted="false" 
                                cryptoProvider="org.apache.juddi.v3.client.crypto.AES128Cryptor">password</signingKeyPassword>
                        <signingKeyAlias>my special key</signingKeyAlias>
                        
                        <canonicalizationMethod>http://www.w3.org/2001/10/xml-exc-c14n#</canonicalizationMethod>
                        <signatureMethod>http://www.w3.org/2000/09/xmldsig#rsa-sha1</signatureMethod>
                        <XML_DIGSIG_NS>http://www.w3.org/2000/09/xmldsig#</XML_DIGSIG_NS>

                        <!-- validation stuff 
                        Used whenever someone views an entity that is signed and validation is required	-->
                        <!-- if this doesn't exist or is incorrect, the client will atempt to load the standard jdk trust store-->
                        <trustStorePath>truststore.jks</trustStorePath>
                        <trustStoreType>JKS</trustStoreType>
                        <trustStorePassword
                                isPasswordEncrypted="false" 
                                cryptoProvider="org.apache.juddi.v3.client.crypto.AES128Cryptor">password</trustStorePassword>
			
                        <checkTimestamps>true</checkTimestamps>
                        <checkTrust>true</checkTrust>
                        <checkRevocationCRL>true</checkRevocationCRL>
                        <keyInfoInclusionSubjectDN>false</keyInfoInclusionSubjectDN>
                        <keyInfoInclusionSerial>false</keyInfoInclusionSerial>
                        <keyInfoInclusionBase64PublicKey>true</keyInfoInclusionBase64PublicKey>
                        <digestMethod>http://www.w3.org/2000/09/xmldsig#sha1</digestMethod>
                </signature>
                <subscriptionCallbacks>
                        <keyDomain>uddi:somebusiness</keyDomain>
                        <listenUrl>http://MyHostname:4444/callback</listenUrl>
                        <autoRegisterBindingTemplate>false</autoRegisterBindingTemplate>
                        <autoRegisterBusinessServiceKey>uddi:somebusiness:someservicekey</autoRegisterBusinessServiceKey>
                        <signatureBehavior>DoNothing</signatureBehavior>
                        <!--valid values are AbortIfSigned,Sign,DoNothing,SignOnlyIfParentIsntSigned, default is DoNothing-->
                </subscriptionCallbacks>
                <XtoWsdl>
                        <IgnoreSSLErrors>false</IgnoreSSLErrors>
                </XtoWsdl>
        </client>
</uddi>