<?xml version="1.0" encoding="ISO-8859-1" ?>
<uddi xmlns="urn:juddi-apache-org:v3_client" xmlns:xsi="http://www.w3.org/2001/XMLSchema-instance" xsi:schemaLocation="classpath:/xsd/uddi-client.xsd">
    <reloadDelay>5000</reloadDelay>
    <client name="client-and-server">
		<nodes>
			<node>
			    <!-- required 'default' node -->
				<name>default</name> 
				<description>Main jUDDI node</description>
				<!-- In VM Transport Settings -->
                <proxyTransport>org.apache.juddi.v3.client.transport.InVMTransport</proxyTransport>
                <custodyTransferUrl>org.apache.juddi.api.impl.UDDICustodyTransferImpl</custodyTransferUrl>
                <inquiryUrl>org.apache.juddi.api.impl.UDDIInquiryImpl</inquiryUrl>
				<inquiryRESTUrl>http://${serverName}:${serverPort}/juddiv3/services/inquiryRest</inquiryRESTUrl>
                <publishUrl>org.apache.juddi.api.impl.UDDIPublicationImpl</publishUrl>
                <securityUrl>org.apache.juddi.api.impl.UDDISecurityImpl</securityUrl>
                <subscriptionUrl>org.apache.juddi.api.impl.UDDISubscriptionImpl</subscriptionUrl>
                <subscriptionListenerUrl>org.apache.juddi.api.impl.UDDISubscriptionListenerImpl</subscriptionListenerUrl>
                <juddiApiUrl>org.apache.juddi.api.impl.JUDDIApiImpl</juddiApiUrl>
			</node>
		</nodes>
	</client>
</uddi>
